date,title,summary,url,source,text_for_nlp,is_tesla_related,is_musk_related
2023-01-02 17:18:21,"Tesla Car Sales Grow Slower Than Expected, Amplifying Concerns","Wall Street has grown decidedly pessimistic about Tesla, fearful that Elon Musk, its chief executive, is too focused on Twitter.",https://www.nytimes.com/2023/01/02/business/tesla-fourth-quarter-sales.html,NYT,"Tesla Car Sales Grow Slower Than Expected, Amplifying Concerns Wall Street has grown decidedly pessimistic about Tesla, fearful that Elon Musk, its chief executive, is too focused on Twitter.",1,1
2023-01-03 00:00:00,"Tesla driver who plunged his family off California cliff did so on purpose, officials say","A California man intentionally drove a Tesla off a 250-foot cliff in an attempt to kill his family, officials said Tuesday.",https://www.nbcnews.com/news/us-news/tesla-driver-plunged-family-california-cliff-purpose-officials-say-rcna64170,NBC,"Tesla driver who plunged his family off California cliff did so on purpose, officials say A California man intentionally drove a Tesla off a 250-foot cliff in an attempt to kill his family, officials said Tuesday.",1,0
2023-01-03 00:00:00,Four survive 250-foot plunge off Californian cliff in Tesla,,https://www.nbcnews.com/video/four-survive-250-foot-plunge-off-californian-cliff-in-tesla-159174725567,NBC,Four survive 250-foot plunge off Californian cliff in Tesla,1,0
2023-01-03 00:00:00,Driver arrested for attempted murder after Tesla drove off California cliff,,https://www.nbcnews.com/now/video/driver-arrested-for-attempted-murder-after-tesla-drove-off-california-cliff-159226437993,NBC,Driver arrested for attempted murder after Tesla drove off California cliff,1,0
2023-01-03 00:00:00,Two children and two adults survive after Tesla plunges 250 feet off California cliff,"Two adults and two children, 4 and 9, were rescued from a Tesla that plunged 250 feet off a cliff Monday morning in San Mateo County, California, officials",https://www.nbcnews.com/news/us-news/two-children-two-adults-survive-tesla-plunges-250-feet-california-clif-rcna63999,NBC,"Two children and two adults survive after Tesla plunges 250 feet off California cliff Two adults and two children, 4 and 9, were rescued from a Tesla that plunged 250 feet off a cliff Monday morning in San Mateo County, California, officials",1,0
2023-01-03 00:00:00,Tesla shares tumble following deliveries report,"Shares of Tesla dropped 13% on Tuesday morning, a day after the electric auto maker reported fourth-quarter vehicle production and delivery numbers for 2022.",https://www.nbcnews.com/business/business-news/tesla-shares-tumble-on-deliveries-report-rcna64057,NBC,"Tesla shares tumble following deliveries report Shares of Tesla dropped 13% on Tuesday morning, a day after the electric auto maker reported fourth-quarter vehicle production and delivery numbers for 2022.",1,0
2023-01-03 23:22:05,Twitter to Relax Ban on Political Ads,Elon Musk’s social media service said it would begin to permit cause-based advertising to “facilitate public conversation around important topics.”,https://www.nytimes.com/2023/01/03/technology/twitter-political-ads.html,NYT,Twitter to Relax Ban on Political Ads Elon Musk’s social media service said it would begin to permit cause-based advertising to “facilitate public conversation around important topics.”,0,1
2023-01-04 00:00:00,Twitter says it will relax ban on political advertising,"Twitter says it will ease up on its ban on political advertising, the latest change by Elon Musk as he tries to pump up revenue after purchasing the company.",https://www.nbcnews.com/politics/politics-news/twitter-says-will-relax-ban-political-advertising-rcna64202,NBC,"Twitter says it will relax ban on political advertising Twitter says it will ease up on its ban on political advertising, the latest change by Elon Musk as he tries to pump up revenue after purchasing the company.",0,1
2023-01-04 00:00:00,Man who drove Tesla off cliff with family inside charged with attempted murder,,https://www.nbcnews.com/nightly-news/video/man-who-drove-tesla-off-cliff-with-family-inside-charged-with-attempted-murder-159292485910,NBC,Man who drove Tesla off cliff with family inside charged with attempted murder,1,0
2023-01-04 12:55:56,Tesla Bulls Brace for a Rough Year Ahead,A huge sell-off wiped billions of dollars from the electric carmaker’s market capitalization on Tuesday. Analysts see more trouble ahead.,https://www.nytimes.com/2023/01/04/business/dealbook/tesla-bulls-challenges.html,NYT,Tesla Bulls Brace for a Rough Year Ahead A huge sell-off wiped billions of dollars from the electric carmaker’s market capitalization on Tuesday. Analysts see more trouble ahead.,1,0
2023-01-05 00:00:00,"Unlikely survival of family that plunged off 250-foot California cliff credited to luck, Tesla's design","Survival of California family that plunged 250 feet off cliff due to luck, Tesla's design, experts say",https://www.nbcnews.com/news/us-news/luck-tesla-family-plunged-cliff-rcna64547,NBC,"Unlikely survival of family that plunged off 250-foot California cliff credited to luck, Tesla's design Survival of California family that plunged 250 feet off cliff due to luck, Tesla's design, experts say",1,0
2023-01-05 15:57:58,Tesla Sales in China Slump as Competition Intensifies,Worry about the carmaker’s sales in the world’s largest car market is one reason the shares have plunged.,https://www.nytimes.com/2023/01/05/business/tesla-china-sales-electric-vehicles.html,NYT,Tesla Sales in China Slump as Competition Intensifies Worry about the carmaker’s sales in the world’s largest car market is one reason the shares have plunged.,1,0
2023-01-07 00:00:00,"Elon Musk attorneys try to move trial from California to Texas, citing ‘local negativity’","Attorneys for Tesla and Elon Musk are asking a federal judge in San Francisco to move, or delay, a forthcoming trial from Northern California to Western Texas.",https://www.nbcnews.com/tech/tech-news/elon-musk-attorneys-try-move-trial-california-texas-citing-local-negat-rcna64745,NBC,"Elon Musk attorneys try to move trial from California to Texas, citing ‘local negativity’ Attorneys for Tesla and Elon Musk are asking a federal judge in San Francisco to move, or delay, a forthcoming trial from Northern California to Western Texas.",1,1
2023-01-08 12:00:06,The Week in Business: Slowing Job Growth,"Sam Bankman-Fried, the disgraced cryptocurrency executive, pleads not guilty to an array of charges. A bumpy road ahead for Tesla. And the latest inflation figures are coming out.",https://www.nytimes.com/2023/01/08/business/the-week-in-business-jobs.html,NYT,"The Week in Business: Slowing Job Growth Sam Bankman-Fried, the disgraced cryptocurrency executive, pleads not guilty to an array of charges. A bumpy road ahead for Tesla. And the latest inflation figures are coming out.",1,0
2023-01-09 00:00:00,Tesla owners in China protest against surprise price cuts they missed,"Hundreds of Tesla owners gathered at the automaker's showrooms and distribution centers in China over the weekend, demanding rebates and credit.",https://www.nbcnews.com/news/world/tesla-owners-china-protest-surprise-price-cuts-missed-rcna64838,NBC,"Tesla owners in China protest against surprise price cuts they missed Hundreds of Tesla owners gathered at the automaker's showrooms and distribution centers in China over the weekend, demanding rebates and credit.",1,0
2023-01-09 00:00:00,Musk aims to move Tesla trial from California to Texas,,https://www.nbcnews.com/now/video/musk-aims-to-move-tesla-trial-from-california-to-texas-159583813802,NBC,Musk aims to move Tesla trial from California to Texas,1,1
2023-01-11 00:00:00,Tesla plans to expand Texas factory,,https://www.nbcnews.com/video/tesla-plans-to-expand-texas-gigafactory-159707717870,NBC,Tesla plans to expand Texas factory,1,0
2023-01-11 00:00:00,Tesla plans to spend more than $770 million on Texas factory expansion,Tesla has registered with the state of Texas to expand its electric vehicle factory in Austin this year.,https://www.nbcnews.com/tech/tech-news/tesla-plans-spend-770-million-texas-factory-expansion-rcna65275,NBC,Tesla plans to spend more than $770 million on Texas factory expansion Tesla has registered with the state of Texas to expand its electric vehicle factory in Austin this year.,1,0
2023-01-13 13:44:50,Tesla Cuts Prices Sharply as It Moves to Bolster Demand,The price reductions in the United States will make more of the company’s electric vehicles eligible for a federal tax credit.,https://www.nytimes.com/2023/01/13/business/tesla-price-cut.html,NYT,Tesla Cuts Prices Sharply as It Moves to Bolster Demand The price reductions in the United States will make more of the company’s electric vehicles eligible for a federal tax credit.,1,0
2023-01-15 12:00:06,The Week in Business: More Air Travel Chaos,Consumer prices continue to cool down. Goldman Sachs began one of its largest rounds of layoffs since the 2008 financial crisis. And Elon Musk is to go to trial over a 2018 tweet about Tesla.,https://www.nytimes.com/2023/01/15/business/the-week-in-business-airlines-faa-travel-disruptions.html,NYT,The Week in Business: More Air Travel Chaos Consumer prices continue to cool down. Goldman Sachs began one of its largest rounds of layoffs since the 2008 financial crisis. And Elon Musk is to go to trial over a 2018 tweet about Tesla.,1,1
2023-01-17 00:00:00,"Tesla video promoting self-driving was staged, engineer testifies",A 2016 video that Tesla used to promote its self-driving technology was staged to show capabilities like stopping at a red light and accelerating at a green,https://www.nbcnews.com/business/business-news/tesla-video-promoting-self-driving-was-staged-engineer-testifies-rcna66150,NBC,"Tesla video promoting self-driving was staged, engineer testifies A 2016 video that Tesla used to promote its self-driving technology was staged to show capabilities like stopping at a red light and accelerating at a green",1,0
2023-01-17 00:00:00,Trial starts over Musk's 2018 claim to take Tesla private,,https://www.nbcnews.com/now/video/trial-starts-over-musk-s-2018-claim-to-take-tesla-private-160075333504,NBC,Trial starts over Musk's 2018 claim to take Tesla private,1,1
2023-01-17 10:00:17,Elon Musk Goes to Trial Over His 2018 Plan to Take Tesla Private,Investors are seeking billions of dollars in damages for their losses after Mr. Musk posted a proposal on Twitter that never materialized.,https://www.nytimes.com/2023/01/17/business/elon-musk-tesla-trial-funding-secured.html,NYT,Elon Musk Goes to Trial Over His 2018 Plan to Take Tesla Private Investors are seeking billions of dollars in damages for their losses after Mr. Musk posted a proposal on Twitter that never materialized.,1,1
2023-01-18 00:00:00,Lawyers spar over whether Elon Musk misled investors with his tweets,Opening arguments kicked off Wednesday in a trial that is pitting Tesla against shareholders accusing the company of misleading them over a tweet by Elon Musk,https://www.nbcnews.com/business/business-news/tesla-funding-secured-lawsuit-elon-musk-shareholders-opening-statement-rcna66280,NBC,Lawyers spar over whether Elon Musk misled investors with his tweets Opening arguments kicked off Wednesday in a trial that is pitting Tesla against shareholders accusing the company of misleading them over a tweet by Elon Musk,1,1
2023-01-18 00:00:00,What to expect from Elon Musk’s trial over 2018 Tesla buyout tweets,,https://www.nbcnews.com/now/video/what-to-expect-from-elon-musk-s-trial-over-2018-tesla-buyout-tweets-160108101693,NBC,What to expect from Elon Musk’s trial over 2018 Tesla buyout tweets,1,1
2023-01-20 00:00:00,Elon Musk takes the witness stand in court trial over his failed attempt to take Tesla private,"The court trial to decide whether a tweet Elon Musk sent in 2018 cost Tesla investors millions of dollars will resume Friday, with Musk himself potentially taking the stand.",https://www.nbcnews.com/business/business-news/tesla-shareholder-lawsuit-trial-update-elon-musk-rcna66590,NBC,"Elon Musk takes the witness stand in court trial over his failed attempt to take Tesla private The court trial to decide whether a tweet Elon Musk sent in 2018 cost Tesla investors millions of dollars will resume Friday, with Musk himself potentially taking the stand.",1,1
2023-01-20 22:42:44,Elon Musk Says His Social Media Posts Did Not Drive Tesla’s Stock Price,The chief executive of Tesla testified in a federal civil trial about a 2018 plan to take the automaker private that fizzled out.,https://www.nytimes.com/2023/01/20/business/tesla-elon-musk-trial.html,NYT,Elon Musk Says His Social Media Posts Did Not Drive Tesla’s Stock Price The chief executive of Tesla testified in a federal civil trial about a 2018 plan to take the automaker private that fizzled out.,1,1
2023-01-23 00:00:00,Lawyers press Elon Musk in second day on witness stand over failed Tesla take-private deal,"Tesla CEO Elon Musk told a jury Monday in San Francisco that he was merely considering taking Tesla private when he tweeted in 2018 that he had ""secured"" funding to do so — and that the funding was going to come in part from his stake in SpaceX, Musk's rocket company.",https://www.nbcnews.com/business/business-news/tesla-shareholders-lawsuit-elon-musk-testimony-what-happened-rcna66986,NBC,"Lawyers press Elon Musk in second day on witness stand over failed Tesla take-private deal Tesla CEO Elon Musk told a jury Monday in San Francisco that he was merely considering taking Tesla private when he tweeted in 2018 that he had ""secured"" funding to do so — and that the funding was going to come in part from his stake in SpaceX, Musk's rocket company.",1,1
2023-01-23 18:17:41,Elon Musk Says He Could Have Raised Funds to Take Tesla Private,Mr. Musk testified in a lawsuit filed by investors who claim his 2018 statements about a plan to buy up the carmaker’s stock cost them billions.,https://www.nytimes.com/2023/01/23/business/elon-musk-tesla-trial.html,NYT,Elon Musk Says He Could Have Raised Funds to Take Tesla Private Mr. Musk testified in a lawsuit filed by investors who claim his 2018 statements about a plan to buy up the carmaker’s stock cost them billions.,1,1
2023-01-24 22:14:09,Elon Musk Said Tesla Buyout Plan Didn’t Involve ‘a Specific Number’,"Under questioning, Mr. Musk said he hadn’t discussed how much money investors would put in to help him take his car company private.",https://www.nytimes.com/2023/01/24/business/elon-musk-tesla-trial.html,NYT,"Elon Musk Said Tesla Buyout Plan Didn’t Involve ‘a Specific Number’ Under questioning, Mr. Musk said he hadn’t discussed how much money investors would put in to help him take his car company private.",1,1
2023-01-24 23:03:18,Tesla Will Build Heavy Trucks at a New Factory in Nevada,"The $3.6 billion investment, which also includes a new battery factory, presents a challenge to traditional truck makers that have been slow to sell electric vehicles.",https://www.nytimes.com/2023/01/24/business/tesla-truck-factory-nevada.html,NYT,"Tesla Will Build Heavy Trucks at a New Factory in Nevada The $3.6 billion investment, which also includes a new battery factory, presents a challenge to traditional truck makers that have been slow to sell electric vehicles.",1,0
2023-01-25 00:00:00,Elon Musk's Twitter faces censorship allegations in India free speech battle,Elon Musk is facing allegations of complying with state censorship after Twitter appeared to take sides with India’s government in a turbulent free speech fight.,https://www.nbcnews.com/tech/social-media/modi-twitter-bbc-musk-elon-documentary-watch-video-rcna67497,NBC,Elon Musk's Twitter faces censorship allegations in India free speech battle Elon Musk is facing allegations of complying with state censorship after Twitter appeared to take sides with India’s government in a turbulent free speech fight.,0,1
2023-01-25 21:18:41,Tesla’s Profit Jumped 12% in Fourth Quarter,"The electric car company is facing intensifying competition, supply chain disruptions and concerns about the behavior of Elon Musk.",https://www.nytimes.com/2023/01/25/business/tesla-earnings-fourth-quarter-2022.html,NYT,"Tesla’s Profit Jumped 12% in Fourth Quarter The electric car company is facing intensifying competition, supply chain disruptions and concerns about the behavior of Elon Musk.",1,1
2023-01-26 12:36:32,Tesla Bulls Are Back at the Wheel,"Shares in the electric carmaker continued to rally after the company reported strong profits, even amid growing competition and economic pressures.",https://www.nytimes.com/2023/01/26/business/tesla-profit-stock.html,NYT,"Tesla Bulls Are Back at the Wheel Shares in the electric carmaker continued to rally after the company reported strong profits, even amid growing competition and economic pressures.",1,0
2023-01-27 00:00:00,Elon Musk meets with House Republicans,,https://www.nbcnews.com/now/video/elon-musk-meets-with-house-republicans-161952837597,NBC,Elon Musk meets with House Republicans,0,1
2023-01-27 12:59:28,Mr. Musk Goes to Washington,"Elon Musk, the billionaire owner of Twitter, met with House Speaker Kevin McCarthy, stoking speculation about what the two had discussed.",https://www.nytimes.com/2023/01/27/business/dealbook/musk-mccarthy-twitter.html,NYT,"Mr. Musk Goes to Washington Elon Musk, the billionaire owner of Twitter, met with House Speaker Kevin McCarthy, stoking speculation about what the two had discussed.",0,1
2023-01-30 00:00:00,"Ford cuts prices on electric Mustang Mach-E, following Tesla’s lead","DETROIT — Ford Motor is increasing production and cutting prices of its electric Mustang Mach-E crossover, weeks after industry leader Tesla announced similar plans for its EVs.",https://www.nbcnews.com/business/autos/ford-cuts-prices-electric-mustang-mach-e-teslas-lead-rcna68176,NBC,"Ford cuts prices on electric Mustang Mach-E, following Tesla’s lead DETROIT — Ford Motor is increasing production and cutting prices of its electric Mustang Mach-E crossover, weeks after industry leader Tesla announced similar plans for its EVs.",1,0
2023-01-30 00:00:00,Tesla driver charged with attempted murder after driving family off California cliff,,https://www.nbcnews.com/video/tesla-driver-charged-with-attempted-murder-after-driving-family-off-california-cliff-162162245877,NBC,Tesla driver charged with attempted murder after driving family off California cliff,1,0
2023-01-30 00:00:00,Ford will cut prices for EV Mach-E following Tesla price slash,,https://www.nbcnews.com/now/video/ford-will-cut-prices-for-ev-mach-e-following-tesla-price-slash-162124869625,NBC,Ford will cut prices for EV Mach-E following Tesla price slash,1,0
2023-01-30 00:00:00,"Tesla car battery 'spontaneously' catches fire on California freeway, requiring 6,000 gallons of water to put it out","A Tesla car battery ""spontaneously"" burst into flames on a California freeway Saturday, and firefighters needed 6,000 gallons of water to put it out.",https://www.nbcnews.com/business/business-news/tesla-car-battery-fire-needed-6000-gallons-water-to-extinguish-rcna68153,NBC,"Tesla car battery 'spontaneously' catches fire on California freeway, requiring 6,000 gallons of water to put it out A Tesla car battery ""spontaneously"" burst into flames on a California freeway Saturday, and firefighters needed 6,000 gallons of water to put it out.",1,0
2023-01-30 00:00:00,Tesla driver is charged with attempted murder after allegedly plunging his family off a California cliff on purpose,"Northern California prosecutors on Monday filed attempted murder charges against a motorist who was behind the wheel of a Tesla that went over a cliff, nearly killing himself, his wife and two children.",https://www.nbcnews.com/news/us-news/tesla-driver-charged-attempted-murder-allegedly-plunging-family-califo-rcna68173,NBC,"Tesla driver is charged with attempted murder after allegedly plunging his family off a California cliff on purpose Northern California prosecutors on Monday filed attempted murder charges against a motorist who was behind the wheel of a Tesla that went over a cliff, nearly killing himself, his wife and two children.",1,0
2023-01-30 16:50:57,Ford Follows Tesla in Cutting Electric Vehicle Prices,"The automaker reduced the price of the Mustang Mach-E by up to $5,900 after Tesla slashed prices of its cars by as much as 20 percent.",https://www.nytimes.com/2023/01/30/business/ford-mustang-electric-prices.html,NYT,"Ford Follows Tesla in Cutting Electric Vehicle Prices The automaker reduced the price of the Mustang Mach-E by up to $5,900 after Tesla slashed prices of its cars by as much as 20 percent.",1,0
2023-02-03 00:00:00,Jury finds Elon Musk did not defraud Tesla investors with infamous 'funding secured' claim,"A jury found Elon Musk not liable for costing investors millions of dollars when he issued a series of tweets saying he had ""secured"" funding to take the electric car maker private.",https://www.nbcnews.com/business/business-news/elon-musk-funding-secured-trial-verdict-rcna68634,NBC,"Jury finds Elon Musk did not defraud Tesla investors with infamous 'funding secured' claim A jury found Elon Musk not liable for costing investors millions of dollars when he issued a series of tweets saying he had ""secured"" funding to take the electric car maker private.",1,1
2023-02-03 20:45:43,Jury Rules for Elon Musk and Tesla in Investor Lawsuit Over Tweets,The case centered on whether investors lost money because they believed Mr. Musk’s social media posts about taking Tesla private in 2018.,https://www.nytimes.com/2023/02/03/business/elon-musk-tesla-investor-trial.html,NYT,Jury Rules for Elon Musk and Tesla in Investor Lawsuit Over Tweets The case centered on whether investors lost money because they believed Mr. Musk’s social media posts about taking Tesla private in 2018.,1,1
2023-02-04 04:31:41,"Advisory Firm Sues Elon Musk’s Twitter, Saying It Hasn’t Been Paid","Innisfree M&A says Twitter, which Elon Musk bought last year, has not paid it $1.9 million for services it rendered for the deal.",https://www.nytimes.com/2023/02/03/technology/twitter-elon-musk-adviser-lawsuit.html,NYT,"Advisory Firm Sues Elon Musk’s Twitter, Saying It Hasn’t Been Paid Innisfree M&A says Twitter, which Elon Musk bought last year, has not paid it $1.9 million for services it rendered for the deal.",0,1
2023-02-06 10:00:21,Tesla’s Pickup Truck Is Coming Soon. Maybe.,"Already two years behind schedule, the Cybertruck has experts wondering how the company will manufacture its unusual stainless steel “exoskeleton.”",https://www.nytimes.com/2023/02/06/business/teslas-cybertruck-pickup-stainless-steel.html,NYT,"Tesla’s Pickup Truck Is Coming Soon. Maybe. Already two years behind schedule, the Cybertruck has experts wondering how the company will manufacture its unusual stainless steel “exoskeleton.”",1,0
2023-02-09 00:00:00,Mystery surrounding a fatal Tesla crash with no one behind the wheel is solved,"Investigators from the National Transportation Safety Board apparently have solved the mystery of why no one was found behind the steering wheel of a Tesla that crashed in a Texas two years ago, killing two men.",https://www.nbcnews.com/news/us-news/mystery-surrounding-fatal-tesla-crash-no-one-wheel-solved-rcna69865,NBC,"Mystery surrounding a fatal Tesla crash with no one behind the wheel is solved Investigators from the National Transportation Safety Board apparently have solved the mystery of why no one was found behind the steering wheel of a Tesla that crashed in a Texas two years ago, killing two men.",1,0
2023-02-14 10:00:14,Twitter’s Glitches Are Taking a Toll on Chinese Activists,"As the Elon Musk-owned social media service encounters interruptions and bugs, Chinese dissidents and activists said they feared they were being muzzled.",https://www.nytimes.com/2023/02/14/technology/twitter-china-elon-musk.html,NYT,"Twitter’s Glitches Are Taking a Toll on Chinese Activists As the Elon Musk-owned social media service encounters interruptions and bugs, Chinese dissidents and activists said they feared they were being muzzled.",0,1
2023-02-14 16:00:00,Tesla Workers in Buffalo Begin Union Drive,"If successful, the workers who help develop Tesla’s Autopilot driver-assistance system will be the first group at the company to organize.",https://www.nytimes.com/2023/02/14/business/tesla-buffalo-union-autopilot.html,NYT,"Tesla Workers in Buffalo Begin Union Drive If successful, the workers who help develop Tesla’s Autopilot driver-assistance system will be the first group at the company to organize.",1,0
2023-02-15 00:00:00,"Tesla will open part of electric vehicle charging network to other drivers, White House says","Tesla will open a portion of its electric vehicle charging stations to drivers of other vehicles by the end of next year, the White House said.",https://www.nbcnews.com/politics/white-house/tesla-will-open-part-electric-vehicle-charging-network-drivers-white-h-rcna70744,NBC,"Tesla will open part of electric vehicle charging network to other drivers, White House says Tesla will open a portion of its electric vehicle charging stations to drivers of other vehicles by the end of next year, the White House said.",1,0
