date,title,summary,url,source,text_for_nlp,is_tesla_related,is_musk_related
2023-02-15 10:00:35,Carmakers Are Pushing Autonomous Tech. This Engineer Wants Limits.,"Missy Cummings, who spent more than a year at the federal auto safety agency, said that drivers were putting too much trust in systems like Tesla’s Autopilot and that regulators needed to restrict their use.",https://www.nytimes.com/2023/02/15/business/missy-cummings-tesla-autopilot.html,NYT,"Carmakers Are Pushing Autonomous Tech. This Engineer Wants Limits. Missy Cummings, who spent more than a year at the federal auto safety agency, said that drivers were putting too much trust in systems like Tesla’s Autopilot and that regulators needed to restrict their use.",1,0
2023-02-15 14:19:49,Tesla Will Open Some Chargers to All Electric Vehicles,An agreement with the White House to allow electric cars made by other automakers is part of a broad effort to improve charging and increase sales of battery-powered vehicles.,https://www.nytimes.com/2023/02/15/business/energy-environment/tesla-electric-vehicle-chargers-biden.html,NYT,Tesla Will Open Some Chargers to All Electric Vehicles An agreement with the White House to allow electric cars made by other automakers is part of a broad effort to improve charging and increase sales of battery-powered vehicles.,1,0
2023-02-16 00:00:00,Tesla accused of firing workers amid push to unionize,,https://www.nbcnews.com/now/video/tesla-fires-workers-amid-push-to-unionize-163507269867,NBC,Tesla accused of firing workers amid push to unionize,1,0
2023-02-16 00:00:00,"Tesla recalling nearly 363,000 vehicles over 'full self-driving' software that could lead to crashes","Tesla is recalling 362,758 vehicles because a version of its ""full self-driving"" software may increase the risk of crashes, according to the National Highway Traffic Safety Administration in response to a notice Tesla sent the agency on Wednesday.",https://www.nbcnews.com/business/consumer/tesla-recalls-model-s-model-x-model-3-model-y-fsd-software-rcna71048,NBC,"Tesla recalling nearly 363,000 vehicles over 'full self-driving' software that could lead to crashes Tesla is recalling 362,758 vehicles because a version of its ""full self-driving"" software may increase the risk of crashes, according to the National Highway Traffic Safety Administration in response to a notice Tesla sent the agency on Wednesday.",1,0
2023-02-16 00:00:00,Complaint accuses Tesla of firing more than 30 workers after union effort was announced,"A group of Tesla workers in Buffalo, New York, have filed a complaint with the National Labor Relations Board accusing the electric carmaker of firing at least 30 workers in response to their union organizing efforts.",https://www.nbcnews.com/business/business-news/tesla-fired-workers-after-union-effort-was-announced-complaint-alleges-rcna71008,NBC,"Complaint accuses Tesla of firing more than 30 workers after union effort was announced A group of Tesla workers in Buffalo, New York, have filed a complaint with the National Labor Relations Board accusing the electric carmaker of firing at least 30 workers in response to their union organizing efforts.",1,0
2023-02-16 13:56:18,"Tesla Fired Buffalo Workers Seeking to Organize, Union Says","A filing to the National Labor Relations Board called the dismissals retaliatory. The carmaker denied the allegation, saying they were based on performance.",https://www.nytimes.com/2023/02/16/business/tesla-buffalo-union.html,NYT,"Tesla Fired Buffalo Workers Seeking to Organize, Union Says A filing to the National Labor Relations Board called the dismissals retaliatory. The carmaker denied the allegation, saying they were based on performance.",1,0
2023-02-16 18:26:54,"Tesla to Recall 362,000 Cars With Its ‘Full Self Driving’ System","A federal auto safety agency said the technology can cause crashes, but said the company was unaware of any deaths or injuries caused by the flaws.",https://www.nytimes.com/2023/02/16/business/tesla-recall-full-self-driving.html,NYT,"Tesla to Recall 362,000 Cars With Its ‘Full Self Driving’ System A federal auto safety agency said the technology can cause crashes, but said the company was unaware of any deaths or injuries caused by the flaws.",1,0
2023-02-20 00:00:00,Tesla driver killed after plowing into firetruck on Northern California freeway,"A Tesla driver was killed and a passenger was critically injured Saturday when the car plowed into a fire truck that was parked on a Northern California freeway to shield a crew clearing another accident, fire officials said.",https://www.nbcnews.com/news/us-news/tesla-driver-killed-plowing-firetruck-northern-california-freeway-rcna71436,NBC,"Tesla driver killed after plowing into firetruck on Northern California freeway A Tesla driver was killed and a passenger was critically injured Saturday when the car plowed into a fire truck that was parked on a Northern California freeway to shield a crew clearing another accident, fire officials said.",1,0
2023-02-21 22:57:49,Judge Hears Arguments in Suit Over Musk’s Tesla Pay,Shareholders’ lawyers challenged the board’s contention that Elon Musk’s record-setting compensation was deserved and an effective tool of motivation.,https://www.nytimes.com/2023/02/21/business/elon-musk-tesla-pay-suit.html,NYT,Judge Hears Arguments in Suit Over Musk’s Tesla Pay Shareholders’ lawyers challenged the board’s contention that Elon Musk’s record-setting compensation was deserved and an effective tool of motivation.,1,1
2023-02-23 14:00:09,Why You Should Listen to Twitter on Two-Factor Authentication,Elon Musk was right: Text messages are not the most secure way to protect your account.,https://www.nytimes.com/2023/02/23/technology/personaltech/twitter-two-factor-authentication.html,NYT,Why You Should Listen to Twitter on Two-Factor Authentication Elon Musk was right: Text messages are not the most secure way to protect your account.,0,1
2023-02-27 00:00:00,Elon Musk calls U.S. media and schools 'racist against whites & Asians' after newspapers drop 'Dilbert',"Elon Musk, the CEO of SpaceX, Tesla and Twitter, accused “the media” and “elite colleges and high schools” of being “racist” against white and Asian people.",https://www.nbcnews.com/tech/tech-news/elon-musk-calls-us-media-schools-racist-whites-asians-newspapers-drop-rcna72437,NBC,"Elon Musk calls U.S. media and schools 'racist against whites & Asians' after newspapers drop 'Dilbert' Elon Musk, the CEO of SpaceX, Tesla and Twitter, accused “the media” and “elite colleges and high schools” of being “racist” against white and Asian people.",1,1
2023-02-27 02:01:12,"In Latest Round of Job Cuts, Twitter Is Said to Lay Off at Least 200 Employees","The social media platform now has a work force of less than 2,000, down from 7,500 when Elon Musk took it over in October.",https://www.nytimes.com/2023/02/26/technology/twitter-layoffs.html,NYT,"In Latest Round of Job Cuts, Twitter Is Said to Lay Off at Least 200 Employees The social media platform now has a work force of less than 2,000, down from 7,500 when Elon Musk took it over in October.",0,1
2023-02-27 15:22:58,Musk Claims Media Bias in Debate Over ‘Dilbert’ Creator’s Racist Rant,"The Twitter chief waded into a scandal involving the cartoonist Scott Adams, as Twitter undergoes layoffs and struggles to lure back advertisers.",https://www.nytimes.com/2023/02/27/business/elon-musk-dilbert.html,NYT,"Musk Claims Media Bias in Debate Over ‘Dilbert’ Creator’s Racist Rant The Twitter chief waded into a scandal involving the cartoonist Scott Adams, as Twitter undergoes layoffs and struggles to lure back advertisers.",0,1
2023-02-28 00:00:00,Chinese state-linked paper lashes out at Elon Musk over lab leak theory,A Chinese state-run media outlet has issued a word of warning to Elon Musk: Be careful about how you talk about China.,https://www.nbcnews.com/tech/tech-news/chinese-government-linked-paper-lashes-elon-musk-lab-leak-theory-rcna72788,NBC,Chinese state-linked paper lashes out at Elon Musk over lab leak theory A Chinese state-run media outlet has issued a word of warning to Elon Musk: Be careful about how you talk about China.,0,1
2023-03-01 14:28:20,Tesla Offers a New ‘Master Plan’ but Few Big Revelations,"Elon Musk confirmed his car company would build a factory in Mexico and said it was working on more affordable vehicles. But he did not reveal a new model, disappointing some investors.",https://www.nytimes.com/2023/03/01/business/tesla-musk-investors.html,NYT,"Tesla Offers a New ‘Master Plan’ but Few Big Revelations Elon Musk confirmed his car company would build a factory in Mexico and said it was working on more affordable vehicles. But he did not reveal a new model, disappointing some investors.",1,1
2023-03-02 00:00:00,Tesla stock falls as investor day falls short on specifics,"Electric vehicle maker Tesla hosted a 2023 investor day presentation in Austin, Texas, on Wednesday.",https://www.nbcnews.com/tech/tech-news/tesla-stock-falls-investor-day-falls-short-specifics-rcna73066,NBC,"Tesla stock falls as investor day falls short on specifics Electric vehicle maker Tesla hosted a 2023 investor day presentation in Austin, Texas, on Wednesday.",1,0
2023-03-03 21:56:30,"Tesla Could Start Making Cars in Mexico Next Year, Governor Says",The governor of Nuevo León said a Tesla official had told him that the company’s plant there would be among its biggest and go up in record time.,https://www.nytimes.com/2023/03/03/business/energy-environment/tesla-nuevo-leon-mexico-factory.html,NYT,"Tesla Could Start Making Cars in Mexico Next Year, Governor Says The governor of Nuevo León said a Tesla official had told him that the company’s plant there would be among its biggest and go up in record time.",1,0
2023-03-07 22:05:45,Elon Musk Says Twitter’s Finances Are Improving After Big Cuts,"On a day Mr. Musk said the company was recovering from a sharp drop in ad sales, he found himself apologizing to a former employee with a disability he had disparaged.",https://www.nytimes.com/2023/03/07/business/elon-musk-twitter-finances.html,NYT,"Elon Musk Says Twitter’s Finances Are Improving After Big Cuts On a day Mr. Musk said the company was recovering from a sharp drop in ad sales, he found himself apologizing to a former employee with a disability he had disparaged.",0,1
2023-03-08 00:00:00,Feds investigating Tesla over complaints that steering wheels are falling off while driving,U.S. auto safety regulators have opened an investigation into Tesla’s Model Y SUV after getting two complaints that the steering wheels can come off while being driven.,https://www.nbcnews.com/business/autos/feds-investigating-tesla-complaints-steering-wheels-are-falling-drivin-rcna73935,NBC,Feds investigating Tesla over complaints that steering wheels are falling off while driving U.S. auto safety regulators have opened an investigation into Tesla’s Model Y SUV after getting two complaints that the steering wheels can come off while being driven.,1,0
2023-03-08 00:29:21,F.T.C. Intensifies Investigation of Twitter’s Privacy Practices,"The commission is seeking an interview with Elon Musk, who has made major cuts at the company since acquiring it last year.",https://www.nytimes.com/2023/03/07/technology/ftc-twitter-investigation-privacy.html,NYT,"F.T.C. Intensifies Investigation of Twitter’s Privacy Practices The commission is seeking an interview with Elon Musk, who has made major cuts at the company since acquiring it last year.",0,1
2023-03-14 00:00:00,Two Canadian motorists unknowingly open wrong Teslas and are allowed to drive away,"A pair of Canadian Tesla owners accidentally climbed into the wrong cars before their apps allowed them to drive away in lookalike vehicles, they said Tuesday.",https://www.nbcnews.com/news/us-news/canadian-motorist-unknowingly-opens-wrong-tesla-allowed-drive-away-rcna74872,NBC,"Two Canadian motorists unknowingly open wrong Teslas and are allowed to drive away A pair of Canadian Tesla owners accidentally climbed into the wrong cars before their apps allowed them to drive away in lookalike vehicles, they said Tuesday.",1,0
2023-03-14 00:00:00,"Driver accidentally unlocks, drives Tesla after mistaking it for his own",,https://www.nbcnews.com/now/video/driver-accidentally-unlocks-drives-tesla-after-mistaking-it-for-his-own-165203525682,NBC,"Driver accidentally unlocks, drives Tesla after mistaking it for his own",1,0
2023-03-17 15:15:52,Twitter’s Talks Over Licensing Music Are Said to Stall Under Musk,"Twitter didn’t move forward with the music licensing deals because of costs, people with knowledge of the matter said.",https://www.nytimes.com/2023/03/17/technology/twitters-music-elon-musk.html,NYT,"Twitter’s Talks Over Licensing Music Are Said to Stall Under Musk Twitter didn’t move forward with the music licensing deals because of costs, people with knowledge of the matter said.",0,1
2023-03-26 17:33:49,Elon Musk Values Twitter at $20 Billion,The billionaire bought the social media company for $44 billion in October and took it private.,https://www.nytimes.com/2023/03/26/technology/elon-musk-twitter-value.html,NYT,Elon Musk Values Twitter at $20 Billion The billionaire bought the social media company for $44 billion in October and took it private.,0,1
2023-03-26 22:06:02,Twitter Says Parts of Its Source Code Were Leaked Online,"The leak adds to the challenges facing the Elon Musk-owned company, which is trying to identify the person responsible and any other people who downloaded the code.",https://www.nytimes.com/2023/03/26/technology/twitter-source-code-leak.html,NYT,"Twitter Says Parts of Its Source Code Were Leaked Online The leak adds to the challenges facing the Elon Musk-owned company, which is trying to identify the person responsible and any other people who downloaded the code.",0,1
2023-03-28 00:00:00,Feds launch investigation into Tesla seat belt parts,The National Highway Transportation Safety Administration has launched an investigation into seat belt parts on 2022 to 2023 Tesla Model X SUVs.,https://www.nbcnews.com/business/autos/tesla-seat-belt-investigation-nhtsa-rcna76989,NBC,Feds launch investigation into Tesla seat belt parts The National Highway Transportation Safety Administration has launched an investigation into seat belt parts on 2022 to 2023 Tesla Model X SUVs.,1,0
2023-03-28 00:00:00,Twitter celebs balk at paying Elon Musk for their blue check marks,"William Shatner, Monica Lewinsky and other prolific Twitter commentators could soon be losing the blue check marks that helped verify their identity on the social media platform.",https://www.nbcnews.com/tech/tech-news/twitter-celebs-balk-paying-elon-musk-blue-check-mark-rcna76968,NBC,"Twitter celebs balk at paying Elon Musk for their blue check marks William Shatner, Monica Lewinsky and other prolific Twitter commentators could soon be losing the blue check marks that helped verify their identity on the social media platform.",0,1
2023-03-29 14:23:05,"Elon Musk and Others Call for Pause on A.I., Citing ‘Profound Risks to Society’","More than 1,000 tech leaders, researchers and others signed an open letter urging a moratorium on the development of the most powerful artificial intelligence systems.",https://www.nytimes.com/2023/03/29/technology/ai-artificial-intelligence-musk-risks.html,NYT,"Elon Musk and Others Call for Pause on A.I., Citing ‘Profound Risks to Society’ More than 1,000 tech leaders, researchers and others signed an open letter urging a moratorium on the development of the most powerful artificial intelligence systems.",0,1
2023-03-30 19:31:10,Elon Musk Tried to Meet With F.T.C. Chair About Twitter but Was Rebuffed,"Mr. Musk requested a meeting with Lina Khan, the chair of the F.T.C., which has been investigating Twitter’s privacy and data practices.",https://www.nytimes.com/2023/03/30/technology/elon-musk-ftc-chair.html,NYT,"Elon Musk Tried to Meet With F.T.C. Chair About Twitter but Was Rebuffed Mr. Musk requested a meeting with Lina Khan, the chair of the F.T.C., which has been investigating Twitter’s privacy and data practices.",0,1
2023-04-02 16:11:26,Tesla Sales Rose in the First Quarter,The electric car company’s decision to slash prices appears to have offset the effect of higher interest rates.,https://www.nytimes.com/2023/04/02/business/tesla-first-quarter-electric-car-sales.html,NYT,Tesla Sales Rose in the First Quarter The electric car company’s decision to slash prices appears to have offset the effect of higher interest rates.,1,0
2023-04-03 00:00:00,Tesla ordered to pay more than $3 million in damages over racially hostile workplace,"A San Francisco federal jury has ordered Tesla to pay $3 million in punitive damages and $175,000 in economic damages to Owen Diaz, a former elevator operator at the company’s factory in Fremont, California, after he endured a racially hostile work environment during his time at the company.",https://www.nbcnews.com/business/business-news/tesla-ordered-pay-3-million-damages-racially-hostile-workplace-rcna78029,NBC,"Tesla ordered to pay more than $3 million in damages over racially hostile workplace A San Francisco federal jury has ordered Tesla to pay $3 million in punitive damages and $175,000 in economic damages to Owen Diaz, a former elevator operator at the company’s factory in Fremont, California, after he endured a racially hostile work environment during his time at the company.",1,0
2023-04-03 21:25:08,Jury Says Tesla Must Pay Worker $3.2 Million Over Racist Treatment,"A former Tesla factory worker, who is Black, challenged a judge’s earlier award of $15 million, but came away with less in a new trial.",https://www.nytimes.com/2023/04/03/business/tesla-racist-treatment-jury-award.html,NYT,"Jury Says Tesla Must Pay Worker $3.2 Million Over Racist Treatment A former Tesla factory worker, who is Black, challenged a judge’s earlier award of $15 million, but came away with less in a new trial.",1,0
2023-04-06 00:00:00,Tesla workers shared sensitive images recorded by customer cars,Tesla assures its millions of electric car owners that their privacy “is and will always be enormously important to us.”,https://www.nbcnews.com/business/business-news/tesla-workers-shared-sensitive-images-recorded-by-customer-cars-rcna78502,NBC,Tesla workers shared sensitive images recorded by customer cars Tesla assures its millions of electric car owners that their privacy “is and will always be enormously important to us.”,1,0
2023-04-07 09:00:34,How Elon Musk Is Changing the Twitter Experience,"Nearly six months after buying Twitter, Mr. Musk has made tweaks that have altered what people see on the platform and how they interact with it.",https://www.nytimes.com/2023/04/07/technology/elon-musk-twitter-changes.html,NYT,"How Elon Musk Is Changing the Twitter Experience Nearly six months after buying Twitter, Mr. Musk has made tweaks that have altered what people see on the platform and how they interact with it.",0,1
2023-04-07 19:01:31,Twitter Takes Aim at Posts That Link to Its Rival Substack,Elon Musk’s company made the norm-shattering move two days after the publishing start-up Substack unveiled a Twitter-like service.,https://www.nytimes.com/2023/04/07/technology/twitter-substack-elon-musk.html,NYT,Twitter Takes Aim at Posts That Link to Its Rival Substack Elon Musk’s company made the norm-shattering move two days after the publishing start-up Substack unveiled a Twitter-like service.,0,1
2023-04-09 19:33:36,Tesla to Build Factory in Shanghai for Large-Scale Batteries,"The company plans to break ground this year on a plant that will produce 10,000 of its energy-storage units known as Megapacks annually.",https://www.nytimes.com/2023/04/09/business/tesla-shanghai-megapacks-batteries.html,NYT,"Tesla to Build Factory in Shanghai for Large-Scale Batteries The company plans to break ground this year on a plant that will produce 10,000 of its energy-storage units known as Megapacks annually.",1,0
2023-04-10 01:02:40,Elon Musk Says Tesla Will Build Shanghai Battery Factory,The facility will produce large batteries that will help electric utilities stabilize grids and use more renewable energy.,https://www.nytimes.com/2023/04/09/business/elon-musk-tesla-shanghai-battery-factory.html,NYT,Elon Musk Says Tesla Will Build Shanghai Battery Factory The facility will produce large batteries that will help electric utilities stabilize grids and use more renewable energy.,1,1
2023-04-12 11:57:45,Elon Musk Addresses the ‘Painful’ Side of Running Twitter,"The social network's owner  talks about bots, blue checks and why he went ahead with the $44 billion acquisition.",https://www.nytimes.com/2023/04/12/business/dealbook/elon-musk-twitter-bbc-interview.html,NYT,"Elon Musk Addresses the ‘Painful’ Side of Running Twitter The social network's owner  talks about bots, blue checks and why he went ahead with the $44 billion acquisition.",0,1
2023-04-19 20:57:46,Tesla’s Profit Dropped Sharply in First Quarter as It Cut Prices,The electric carmaker has reduced prices by thousands of dollars this year to bolster demand and fend off competition.,https://www.nytimes.com/2023/04/19/business/teslas-earnings-first-quarter.html,NYT,Tesla’s Profit Dropped Sharply in First Quarter as It Cut Prices The electric carmaker has reduced prices by thousands of dollars this year to bolster demand and fend off competition.,1,0
2023-04-20 19:00:33,Twitter Begins Removing Check Marks From Accounts,"Elon Musk, the owner of the social media service, has begun to charge a subscription fee for the verification symbol.",https://www.nytimes.com/2023/04/20/technology/twitter-blue-check-marks.html,NYT,"Twitter Begins Removing Check Marks From Accounts Elon Musk, the owner of the social media service, has begun to charge a subscription fee for the verification symbol.",0,1
2023-04-21 00:00:00,Elon Musk’s Twitter drops government-funded media labels,Twitter has removed labels describing global media organizations as government-funded or state-affiliated.,https://www.nbcnews.com/tech/social-media/elon-musks-twitter-drops-government-funded-media-labels-rcna80811,NBC,Elon Musk’s Twitter drops government-funded media labels Twitter has removed labels describing global media organizations as government-funded or state-affiliated.,0,1
2023-04-21 00:00:00,California jury finds Tesla Autopilot did not fail in crash case,"A California state court jury on Friday handed Tesla a sweeping win, finding that the car maker’s Autopilot feature did not fail to perform safely in what appears to be the first trial related to a crash involving the partially automated driving software.",https://www.nbcnews.com/business/business-news/california-jury-finds-tesla-autopilot-not-fail-crash-case-rcna80902,NBC,"California jury finds Tesla Autopilot did not fail in crash case A California state court jury on Friday handed Tesla a sweeping win, finding that the car maker’s Autopilot feature did not fail to perform safely in what appears to be the first trial related to a crash involving the partially automated driving software.",1,0
2023-04-26 00:00:00,Elon Musk meets with Sen. Schumer to discuss artificial intelligence,Elon Musk visited Capitol Hill on Wednesday to meet with Senate Majority Leader Chuck Schumer for a discussion that focused on artificial intelligence.,https://www.nbcnews.com/politics/congress/elon-musk-meets-schumer-discuss-artificial-intelligence-rcna81696,NBC,Elon Musk meets with Sen. Schumer to discuss artificial intelligence Elon Musk visited Capitol Hill on Wednesday to meet with Senate Majority Leader Chuck Schumer for a discussion that focused on artificial intelligence.,0,1
2023-04-27 09:00:23,"Elon Musk Ramps Up A.I. Efforts, Even as He Warns of Dangers","The billionaire plans to compete with OpenAI, the ChatGPT developer he helped found, while calling out the potential harms of artificial intelligence.",https://www.nytimes.com/2023/04/27/technology/elon-musk-ai-openai.html,NYT,"Elon Musk Ramps Up A.I. Efforts, Even as He Warns of Dangers The billionaire plans to compete with OpenAI, the ChatGPT developer he helped found, while calling out the potential harms of artificial intelligence.",0,1
2023-05-03 15:25:45,"Jack Dorsey Has a Lot to Say, Including About Elon Musk and Twitter","The Twitter co-founder has posted prolifically on two new social networks, Nostr and Bluesky, which he also backed financially.",https://www.nytimes.com/2023/05/03/technology/dorsey-musk-twitter-bluesky-nostr.html,NYT,"Jack Dorsey Has a Lot to Say, Including About Elon Musk and Twitter The Twitter co-founder has posted prolifically on two new social networks, Nostr and Bluesky, which he also backed financially.",0,1
2023-05-04 00:00:00,One killed in shooting at Colorado Tesla charging station,,https://www.nbcnews.com/video/one-killed-in-shooting-at-colorado-tesla-charging-station-172748357534,NBC,One killed in shooting at Colorado Tesla charging station,1,0
2023-05-04 00:00:00,Tesla driver fatally shot in fight at Denver charging station,"A fight at an electric vehicle charging station in suburban Denver escalated into a fatal shooting that killed a Tesla driver and put another man in custody, authorities said.",https://www.nbcnews.com/news/us-news/tesla-driver-fatally-shot-fight-denver-charging-station-rcna82836,NBC,"Tesla driver fatally shot in fight at Denver charging station A fight at an electric vehicle charging station in suburban Denver escalated into a fatal shooting that killed a Tesla driver and put another man in custody, authorities said.",1,0
