date,title,summary,url,source,text_for_nlp,is_tesla_related,is_musk_related
2023-05-10 12:17:18,Is Tucker Carlson Too Hot for Twitter to Handle?,"Elon Musk didn't exactly give the conservative media star a warm embrace, suggesting the outspoken owner has reservations.",https://www.nytimes.com/2023/05/10/business/dealbook/tucker-carlson-elon-musk-twitter.html,NYT,"Is Tucker Carlson Too Hot for Twitter to Handle? Elon Musk didn't exactly give the conservative media star a warm embrace, suggesting the outspoken owner has reservations.",0,1
2023-05-11 00:00:00,Elon Musk says he's hired a new CEO for Twitter and will reduce his own role,Twitter owner Elon Musk said Thursday he has hired a new CEO to run the social media platform.,https://www.nbcnews.com/tech/tech-news/elon-musk-says-hired-new-ceo-twitter-will-reduce-role-rcna84038,NBC,Elon Musk says he's hired a new CEO for Twitter and will reduce his own role Twitter owner Elon Musk said Thursday he has hired a new CEO to run the social media platform.,0,1
2023-05-11 20:28:34,Elon Musk Says He Has a New C.E.O. for Twitter,"Mr. Musk is in talks about the role with Linda Yaccarino, chairman of global advertising and partnerships at NBCUniversal, two people with knowledge of the matter said.",https://www.nytimes.com/2023/05/11/technology/elon-musk-ceo-twitter.html,NYT,"Elon Musk Says He Has a New C.E.O. for Twitter Mr. Musk is in talks about the role with Linda Yaccarino, chairman of global advertising and partnerships at NBCUniversal, two people with knowledge of the matter said.",0,1
2023-05-12 00:00:00,China says Tesla to fix software for 1.1 million vehicles with braking issue,China’s market regulator said Tesla Inc.,https://www.nbcnews.com/business/autos/china-says-tesla-fix-software-11-million-cars-braking-issue-rcna84137,NBC,China says Tesla to fix software for 1.1 million vehicles with braking issue China’s market regulator said Tesla Inc.,1,0
2023-05-12 13:24:35,Elon Musk Appoints Linda Yaccarino Twitter’s New Chief,Mr. Musk said Ms. Yaccarino would focus on business operations and he would work on product design and technology at the social media platform.,https://www.nytimes.com/2023/05/12/technology/yaccarino-twitter-ceo-musk.html,NYT,Elon Musk Appoints Linda Yaccarino Twitter’s New Chief Mr. Musk said Ms. Yaccarino would focus on business operations and he would work on product design and technology at the social media platform.,0,1
2023-05-14 11:00:05,The Week in Business: Trump on TV,Inflation continues to slow. Elon Musk says he’s found a new C.E.O. for Twitter. And there will be a pair of Senate hearings on the banking crisis.,https://www.nytimes.com/2023/05/14/business/the-week-in-business-trump-cnn.html,NYT,The Week in Business: Trump on TV Inflation continues to slow. Elon Musk says he’s found a new C.E.O. for Twitter. And there will be a pair of Senate hearings on the banking crisis.,0,1
2023-05-15 00:00:00,"Elon Musk still needs 'Twitter sitter,' judges rule",Tesla CEO Elon Musk lost an appeal to unwind parts of a consent decree that he and the automaker struck with the Securities and Exchange Commission to settle civil securities fraud charges in 2018.,https://www.nbcnews.com/business/business-news/elon-musk-still-needs-twitter-sitter-judges-rule-rcna84504,NBC,"Elon Musk still needs 'Twitter sitter,' judges rule Tesla CEO Elon Musk lost an appeal to unwind parts of a consent decree that he and the automaker struck with the Securities and Exchange Commission to settle civil securities fraud charges in 2018.",1,1
2023-05-16 00:00:00,Elon Musk says 'so be it' to consequences of his tweeting,"Tech billionaire Elon Musk defended his promotion of conspiracy theories, called the work-from-home trend morally wrong and criticized the direction of tech startup OpenAI in a wide-ranging and at times combative interview Tuesday with CNBC.",https://www.nbcnews.com/tech/tech-news/musks-says-consequences-tweeting-rcna84758,NBC,"Elon Musk says 'so be it' to consequences of his tweeting Tech billionaire Elon Musk defended his promotion of conspiracy theories, called the work-from-home trend morally wrong and criticized the direction of tech startup OpenAI in a wide-ranging and at times combative interview Tuesday with CNBC.",0,1
2023-05-16 00:00:00,Elon Musk to be subpoenaed for documents in Virgin Islands' Epstein lawsuit against JPMorgan,"The U.S. Virgin Islands issued a subpoena to Tesla CEO Elon Musk seeking documents for that government’s lawsuit against JPMorgan Chase over sex trafficking by the bank’s late longtime customer Jeffrey Epstein, a court filing revealed Monday.",https://www.nbcnews.com/business/business-news/elon-musk-subpoenaed-documents-virgin-islands-epstein-lawsuit-jpmorgan-rcna84612,NBC,"Elon Musk to be subpoenaed for documents in Virgin Islands' Epstein lawsuit against JPMorgan The U.S. Virgin Islands issued a subpoena to Tesla CEO Elon Musk seeking documents for that government’s lawsuit against JPMorgan Chase over sex trafficking by the bank’s late longtime customer Jeffrey Epstein, a court filing revealed Monday.",1,1
2023-05-16 09:00:22,Musk Warns Tesla Shareholders to Expect “Challenging” Year,"Tesla will not escape the effects of a global economic downturn, Mr. Musk said at the carmaker’s annual meeting. But he insisted Tesla would emerge stronger.",https://www.nytimes.com/2023/05/16/business/tesla-shareholder-annual-meeting.html,NYT,"Musk Warns Tesla Shareholders to Expect “Challenging” Year Tesla will not escape the effects of a global economic downturn, Mr. Musk said at the carmaker’s annual meeting. But he insisted Tesla would emerge stronger.",1,1
2023-05-17 00:00:00,Twitter CEO Elon Musk addresses conspiracy theories in CNBC interview,,https://www.nbcnews.com/now/video/twitter-ceo-elon-musk-addresses-conspiracy-theories-in-cnbc-interview-174628933672,NBC,Twitter CEO Elon Musk addresses conspiracy theories in CNBC interview,0,1
2023-05-18 00:00:00,"Wife of radiologist who drove Tesla off Calif. cliff with family inside said he did it 'on purpose,' unsealed docs reveal","The wife of the California radiologist accused of intentionally driving his Tesla off a 330-foot cliff with her and their two young children inside early this year told authorities he plunged off the precipice “on purpose,” newly unsealed documents reveal.",https://www.nbcnews.com/news/us-news/wife-radiologist-drove-tesla-ca-cliff-family-said-purpose-unsealed-doc-rcna85033,NBC,"Wife of radiologist who drove Tesla off Calif. cliff with family inside said he did it 'on purpose,' unsealed docs reveal The wife of the California radiologist accused of intentionally driving his Tesla off a 330-foot cliff with her and their two young children inside early this year told authorities he plunged off the precipice “on purpose,” newly unsealed documents reveal.",1,0
2023-05-18 00:00:00,"Man intentionally drove Tesla off cliff with family inside, wife says",,https://www.nbcnews.com/video/man-intentionally-drove-tesla-off-cliff-with-family-inside-wife-says-174839877835,NBC,"Man intentionally drove Tesla off cliff with family inside, wife says",1,0
2023-05-19 00:00:00,"Morning Rundown: G-7 summit, New Mexico mass shooting bodycam, Tesla cliff crash",Get everything you need to know to start your day. Sign up to get the Morning Rundown newsletter to your email inbox.,https://www.nbcnews.com/news/morning-rundown-may-19-rcna85210,NBC,"Morning Rundown: G-7 summit, New Mexico mass shooting bodycam, Tesla cliff crash Get everything you need to know to start your day. Sign up to get the Morning Rundown newsletter to your email inbox.",1,0
2023-05-24 00:00:00,"With DeSantis event, Twitter solidifies its place in the conservative media world",Democratic strategists said the joint Musk-DeSantis event was the latest example of the billionaire aligning himself and Twitter with conservative politics.,https://www.nbcnews.com/tech/social-media/desantis-twitter-conservative-media-rcna86150,NBC,"With DeSantis event, Twitter solidifies its place in the conservative media world Democratic strategists said the joint Musk-DeSantis event was the latest example of the billionaire aligning himself and Twitter with conservative politics.",0,1
2023-05-24 22:57:12,Elon Musk’s Event With Ron DeSantis Exposes Twitter’s Weaknesses,What was supposed to be a crowning moment for Mr. Musk’s Twitter turned into a series of technical glitches.,https://www.nytimes.com/2023/05/24/technology/elon-musk-desantis-twitter.html,NYT,Elon Musk’s Event With Ron DeSantis Exposes Twitter’s Weaknesses What was supposed to be a crowning moment for Mr. Musk’s Twitter turned into a series of technical glitches.,0,1
2023-05-26 00:00:00,Ford EVs will use Tesla charging tech in surprise partnership between rival automakers,"DETROIT — Ford Motor will partner with Tesla on charging initiatives for its current and future electric vehicles in an unusual tie-up between the two rivals, CEOs of the automakers announced Thursday.",https://www.nbcnews.com/tech/tech-news/ford-evs-will-use-tesla-charging-tech-surprise-partnership-rival-autom-rcna86423,NBC,"Ford EVs will use Tesla charging tech in surprise partnership between rival automakers DETROIT — Ford Motor will partner with Tesla on charging initiatives for its current and future electric vehicles in an unusual tie-up between the two rivals, CEOs of the automakers announced Thursday.",1,0
2023-05-26 00:00:00,Elon Musk’s brain implant company Neuralink announces FDA approval of in-human clinical study,"Neuralink, the neurotech startup co-founded by Elon Musk, announced Thursday it has received approval from the Food and Drug Administration to conduct its first in-human clinical study.",https://www.nbcnews.com/business/business-news/elon-musks-brain-implant-company-neuralink-announces-fda-approval-huma-rcna86384,NBC,"Elon Musk’s brain implant company Neuralink announces FDA approval of in-human clinical study Neuralink, the neurotech startup co-founded by Elon Musk, announced Thursday it has received approval from the Food and Drug Administration to conduct its first in-human clinical study.",0,1
2023-05-30 00:00:00,"Elon Musk meets Chinese foreign minister, who calls for ‘mutual respect’ in U.S. relations","China’s foreign minister met Tesla CEO Elon Musk on Tuesday and said strained U.S.-Chinese relations require “mutual respect,” while delivering a message of reassurance that foreign companies are welcome.",https://www.nbcnews.com/news/world/elon-musk-china-foreign-minister-us-business-rcna86777,NBC,"Elon Musk meets Chinese foreign minister, who calls for ‘mutual respect’ in U.S. relations China’s foreign minister met Tesla CEO Elon Musk on Tuesday and said strained U.S.-Chinese relations require “mutual respect,” while delivering a message of reassurance that foreign companies are welcome.",1,1
2023-06-02 00:00:00,Elon Musk meets Chinese officials in Shanghai,,https://www.nbcnews.com/video/elon-musk-meets-chinese-officials-in-shanghai-179322949906,NBC,Elon Musk meets Chinese officials in Shanghai,0,1
2023-06-02 00:00:00,Musk leaves China after whirlwind trip filled with praise and politics,"World’s richest man Elon Musk was welcomed by top officials and hailed by citizens during his China visit, opposing “decoupling” amid China-U.S. tensions.",https://www.nbcnews.com/news/world/musk-china-politics-tesla-twitter-rcna87378,NBC,"Musk leaves China after whirlwind trip filled with praise and politics World’s richest man Elon Musk was welcomed by top officials and hailed by citizens during his China visit, opposing “decoupling” amid China-U.S. tensions.",0,1
2023-06-08 00:00:00,"Black workers at California Tesla factory allege rampant racism, seek class-action status",Tesla may face a class-action lawsuit after 240 Black factory workers in California described rampant racism and discrimination at the electric automaker’s San Francisco Bay Area plant.,https://www.nbcnews.com/business/business-news/black-workers-california-tesla-factory-allege-rampant-racism-rcna88343,NBC,"Black workers at California Tesla factory allege rampant racism, seek class-action status Tesla may face a class-action lawsuit after 240 Black factory workers in California described rampant racism and discrimination at the electric automaker’s San Francisco Bay Area plant.",1,0
2023-06-08 21:13:32,Tesla Will Open Its Charging Network to G.M.’s Electric Vehicles,"The electric car company, which operates the country’s most extensive charging network, struck a similar deal with Ford Motor recently.",https://www.nytimes.com/2023/06/08/business/general-motors-tesla-electric-vehicles-charging.html,NYT,"Tesla Will Open Its Charging Network to G.M.’s Electric Vehicles The electric car company, which operates the country’s most extensive charging network, struck a similar deal with Ford Motor recently.",1,0
2023-06-09 00:00:00,GM and Ford agree to allow electric vehicle drivers to use Tesla chargers,,https://www.nbcnews.com/nightly-news/video/gm-and-ford-agree-to-allow-electric-vehicle-drivers-to-use-tesla-chargers-181544005639,NBC,GM and Ford agree to allow electric vehicle drivers to use Tesla chargers,1,0
2023-06-09 00:00:00,GM’s electric vehicles will gain access to Tesla’s vast charging network,Electric vehicles made by General Motors will be able to use much of Tesla’s extensive charging network beginning early next year.,https://www.nbcnews.com/tech/tech-news/gms-electric-vehicles-will-gain-access-teslas-vast-charging-network-rcna88535,NBC,GM’s electric vehicles will gain access to Tesla’s vast charging network Electric vehicles made by General Motors will be able to use much of Tesla’s extensive charging network beginning early next year.,1,0
2023-06-16 09:00:58,There’s No Uber or Lyft. There Is a Communal Tesla.,An innovative E.V. ride-sharing program is bringing low-cost clean transportation to an agricultural town in California’s Central Valley. Others are following suit.,https://www.nytimes.com/2023/06/16/business/ev-ride-sharing-volunteers.html,NYT,There’s No Uber or Lyft. There Is a Communal Tesla. An innovative E.V. ride-sharing program is bringing low-cost clean transportation to an agricultural town in California’s Central Valley. Others are following suit.,1,0
2023-06-21 00:00:00,‘I am a fan of Modi’: Elon Musk on his friendship with India’s prime minister,"Tesla CEO Elon Musk says he is “incredibly excited about the future of India,” adding that it has “more promise than any large country in the world.”",https://www.nbcnews.com/news/world/-fan-modi-elon-musk-friendship-indian-prime-minister-modi-rcna90319,NBC,"‘I am a fan of Modi’: Elon Musk on his friendship with India’s prime minister Tesla CEO Elon Musk says he is “incredibly excited about the future of India,” adding that it has “more promise than any large country in the world.”",1,1
2023-06-22 14:32:16,Elon Musk Proposes ‘Cage Match’ With Mark Zuckerberg,"The technology moguls who run Twitter and Meta appeared to agree to a fight, the latest twist in a long-running feud.",https://www.nytimes.com/2023/06/22/business/musk-zuckerberg-cage-match.html,NYT,"Elon Musk Proposes ‘Cage Match’ With Mark Zuckerberg The technology moguls who run Twitter and Meta appeared to agree to a fight, the latest twist in a long-running feud.",0,1
2023-06-27 07:00:17,Tesla May Have Already Won the Charging Wars,Deals with Ford and G.M. will make it easier to find a charger but could give Elon Musk control of critical infrastructure.,https://www.nytimes.com/2023/06/27/business/energy-environment/tesla-gm-ford-charging-electric-vehicles.html,NYT,Tesla May Have Already Won the Charging Wars Deals with Ford and G.M. will make it easier to find a charger but could give Elon Musk control of critical infrastructure.,1,1
2023-06-29 09:00:45,Twitter’s New Chief Eases Into the Hot Seat,"Linda Yaccarino, who initially could not take ad sales meetings because of a noncompete clause, is adjusting to her new role reporting to Elon Musk.",https://www.nytimes.com/2023/06/29/technology/twitter-ceo-linda-yaccarino.html,NYT,"Twitter’s New Chief Eases Into the Hot Seat Linda Yaccarino, who initially could not take ad sales meetings because of a noncompete clause, is adjusting to her new role reporting to Elon Musk.",0,1
2023-07-01 09:01:15,A ‘Cage Match’ Between Elon Musk and Mark Zuckerberg May Be No Joke,Talks over a matchup between the two tech billionaires have progressed and the parameters of an event are taking shape.,https://www.nytimes.com/2023/07/01/technology/elon-musk-mark-zuckerberg-cage-match.html,NYT,A ‘Cage Match’ Between Elon Musk and Mark Zuckerberg May Be No Joke Talks over a matchup between the two tech billionaires have progressed and the parameters of an event are taking shape.,0,1
2023-07-02 16:16:50,Tesla Sales Surge as Tax Credits Fuel Demand,"Incentives and price cuts made Tesla electric cars cheaper than comparable gasoline models. But the company faces growing competition in China, a key market.",https://www.nytimes.com/2023/07/02/business/tesla-q2-sales-deliveries.html,NYT,"Tesla Sales Surge as Tax Credits Fuel Demand Incentives and price cuts made Tesla electric cars cheaper than comparable gasoline models. But the company faces growing competition in China, a key market.",1,0
2023-07-03 00:00:00,Tesla sees record global deliveries after lowering prices and tapping into EV tax credits,Tesla reported record quarterly global auto sales after it cut prices on its autos and customers reap the benefits of renewed tax credits for purchasing its electric vehicles.,https://www.nbcnews.com/business/autos/tesla-lower-prices-lead-to-record-global-deliveries-electric-vehicles-rcna92354,NBC,Tesla sees record global deliveries after lowering prices and tapping into EV tax credits Tesla reported record quarterly global auto sales after it cut prices on its autos and customers reap the benefits of renewed tax credits for purchasing its electric vehicles.,1,0
2023-07-06 00:00:00,NHTSA presses Tesla for more records in Autopilot safety probe,Tesla must send extensive new records to the National Highway Traffic and Safety Administration as part of an Autopilot safety probe — or else face steep fines.,https://www.nbcnews.com/business/business-news/nhtsa-presses-tesla-records-autopilot-safety-probe-rcna92869,NBC,NHTSA presses Tesla for more records in Autopilot safety probe Tesla must send extensive new records to the National Highway Traffic and Safety Administration as part of an Autopilot safety probe — or else face steep fines.,1,0
2023-07-07 00:00:00,The (figurative) cage match between Mark Zuckerberg and Elon Musk is on,"With the release of Instagram Threads, it seems Mark Zuckerberg and Elon Musk are already going head-to-head as the war between Meta and and Twitter escalates.",https://www.nbcnews.com/tech/tech-news/instagram-threads-twitter-zuckerberg-musk-fight-match-rcna92840,NBC,"The (figurative) cage match between Mark Zuckerberg and Elon Musk is on With the release of Instagram Threads, it seems Mark Zuckerberg and Elon Musk are already going head-to-head as the war between Meta and and Twitter escalates.",0,1
2023-07-07 20:43:58,Twitter Sues Law Firm Over $90 Million Payment in Elon Musk Deal,"The lawsuit targeted Wachtell, Lipton, Rosen & Katz, a well-known Wall Street law firm, for “unjust enrichment” related to Mr. Musk’s $44 billion purchase of Twitter.",https://www.nytimes.com/2023/07/07/technology/twitter-sues-wachtell-lipton.html,NYT,"Twitter Sues Law Firm Over $90 Million Payment in Elon Musk Deal The lawsuit targeted Wachtell, Lipton, Rosen & Katz, a well-known Wall Street law firm, for “unjust enrichment” related to Mr. Musk’s $44 billion purchase of Twitter.",0,1
2023-07-13 11:33:10,The A.I. Wars Heat Up as Elon Musk and Meta Enter the Ring,"Both Musk, who once backed OpenAI, and Facebook’s parent company are set to unveil new services aimed at getting a piece of the artificial intelligence boom.",https://www.nytimes.com/2023/07/13/business/dealbook/ai-musk-zuckerberg-meta.html,NYT,"The A.I. Wars Heat Up as Elon Musk and Meta Enter the Ring Both Musk, who once backed OpenAI, and Facebook’s parent company are set to unveil new services aimed at getting a piece of the artificial intelligence boom.",0,1
2023-07-17 00:00:00,Elizabeth Warren urges SEC to investigate Tesla over Twitter ties and corporate governance,"Sen. Elizabeth Warren, D-Mass., sent a letter urging the U.S.",https://www.nbcnews.com/tech/tech-news/elizabeth-warren-urges-sec-investigate-tesla-twitter-ties-corporate-go-rcna94740,NBC,"Elizabeth Warren urges SEC to investigate Tesla over Twitter ties and corporate governance Sen. Elizabeth Warren, D-Mass., sent a letter urging the U.S.",1,0
2023-07-17 14:07:51,Electric Vehicle Prices Fall as Automakers Raise Production,"Ford, Tesla and other automakers are having to lower prices to lure buyers as the supply of battery-powered models begins to exceed demand.",https://www.nytimes.com/2023/07/17/business/ford-f150-lightning-electric-vehicle-prices.html,NYT,"Electric Vehicle Prices Fall as Automakers Raise Production Ford, Tesla and other automakers are having to lower prices to lure buyers as the supply of battery-powered models begins to exceed demand.",1,0
2023-07-18 00:00:00,"Chinese electric vehicle makers lead the world, rivaling U.S. pioneers","Chinese electric vehicle companies have grown rapidly in recent years, becoming major competitors for American automakers like Tesla.",https://www.nbcnews.com/news/world/chinese-electric-vehicle-makers-lead-world-rivaling-us-pioneers-rcna88990,NBC,"Chinese electric vehicle makers lead the world, rivaling U.S. pioneers Chinese electric vehicle companies have grown rapidly in recent years, becoming major competitors for American automakers like Tesla.",1,0
2023-07-19 20:20:32,Tesla’s Profit Rose in the Second Quarter as Price Cuts Spurred Demand,Elon Musk’s electric car company is facing intensifying competition from newer Chinese automakers and established Western car companies.,https://www.nytimes.com/2023/07/19/business/tesla-second-quarter-electric-vehicles.html,NYT,Tesla’s Profit Rose in the Second Quarter as Price Cuts Spurred Demand Elon Musk’s electric car company is facing intensifying competition from newer Chinese automakers and established Western car companies.,1,1
2023-07-20 04:00:08,Tesla Wants to Double the Size of Its European Assembly Plant,"The electric automaker wants to produce a million cars a year at its plant near Berlin, a step that would make it Europe’s largest car factory.",https://www.nytimes.com/2023/07/20/business/tesla-germany-assembly-plant.html,NYT,"Tesla Wants to Double the Size of Its European Assembly Plant The electric automaker wants to produce a million cars a year at its plant near Berlin, a step that would make it Europe’s largest car factory.",1,0
2023-07-23 17:08:03,Elon Musk Changes Twitter Logo to an X,"The tech billionaire replaced the company’s blue bird silhouette with “X,” a term for what he has described as an “everything app.”",https://www.nytimes.com/2023/07/23/business/elon-musk-twitter-logo.html,NYT,"Elon Musk Changes Twitter Logo to an X The tech billionaire replaced the company’s blue bird silhouette with “X,” a term for what he has described as an “everything app.”",0,1
2023-07-24 11:55:17,Why Elon Musk Bid Twitter Goodbye,"Rebranding the social network as X marks the billionaire’s latest gamble to reinvent the company, after buying it last year for $44 billion.",https://www.nytimes.com/2023/07/24/business/dealbook/twitter-x-musk.html,NYT,"Why Elon Musk Bid Twitter Goodbye Rebranding the social network as X marks the billionaire’s latest gamble to reinvent the company, after buying it last year for $44 billion.",0,1
2023-07-24 18:03:39,From Twitter to X: Elon Musk Begins Erasing an Iconic Internet Brand,The tech billionaire started removing the bird logo that has been part of Twitter’s identity since 2006.,https://www.nytimes.com/2023/07/24/technology/twitter-x-elon-musk.html,NYT,From Twitter to X: Elon Musk Begins Erasing an Iconic Internet Brand The tech billionaire started removing the bird logo that has been part of Twitter’s identity since 2006.,0,1
2023-07-25 10:30:08,G.M.’s Electric Vehicle Rollout Delayed by Slow Battery Production,The company is earning big profits on gasoline cars and trucks but is struggling to catch up to Tesla in the fastest-growing segment of the auto market.,https://www.nytimes.com/2023/07/25/business/general-motors-electric-vehicles-profits.html,NYT,G.M.’s Electric Vehicle Rollout Delayed by Slow Battery Production The company is earning big profits on gasoline cars and trucks but is struggling to catch up to Tesla in the fastest-growing segment of the auto market.,1,0
2023-07-26 00:00:00,"Tesla under investigation by California attorney general over Autopilot safety, marketing","The California attorney general’s office is investigating Tesla, seeking information from customers and former employees about Autopilot safety issues and false advertising complaints, CNBC has learned.",https://www.nbcnews.com/tech/tech-news/tesla-investigation-california-attorney-general-autopilot-safety-marke-rcna96534,NBC,"Tesla under investigation by California attorney general over Autopilot safety, marketing The California attorney general’s office is investigating Tesla, seeking information from customers and former employees about Autopilot safety issues and false advertising complaints, CNBC has learned.",1,0
